{
  "adapterRef": {
    "id": "ADAPTER-SHARP-NORMALIZE-EXPORT@0.5.0",
    "implementationSha256": "ea521c4de76e18a0dae844686498b5d908fb0434eb9b8eeafffdfccbd57b71b1",
    "version": "0.5.0"
  },
  "attempt": {
    "attemptNumber": 1,
    "idempotencyKey": "s05.smoke.export.83450daf67bf.e18cf8ad9c78.r1.a1",
    "partition": "smoke",
    "repetition": 1,
    "runId": "run.smoke.export.d914d75e54bb9b5e",
    "sourceId": "normalized.s05.export.smoke.004"
  },
  "contentHash": "db21407032fc80b0815d7eeff73259c9bbcffdce9e833aab94ecfc79658920fd",
  "contractRef": {
    "byteLength": 5851,
    "contentHash": "9158ec6b07c3a877976fa48c5001a9f3c65ef746d5d1a99dca74696d58c1d278",
    "fileSha256": "c994b2307e8fc44a5078f864a3ac0c2d91c5a103967e29befee4640456074903",
    "id": "CC-CAP02-EXPORT-PNG@0.5.0",
    "path": "contracts/cc-cap02-export-png.v0.5.0.json"
  },
  "createdAt": "2026-08-15T04:52:09.079Z",
  "definitionRef": {
    "byteLength": 108012,
    "contentHash": "d914d75e54bb9b5e175f774038d41235ebeb6dc5daf4b5235d76b3caf4d5c271",
    "fileSha256": "8cbf1f0aaf018c54b95eaa5ef0f3a2f6cb11dc60529ea569408496514d582d96",
    "id": "DEFINITION-INDEX-SLICE05@0.5.0",
    "path": "definition-index.v0.5.0.json"
  },
  "expectedDisposition": "preflight-reject",
  "expectedStableErrorCode": "S05_EXPORT_NORMALIZED_ARTIFACT_INVALID",
  "goldRecordRef": null,
  "manifestEntryRef": {
    "contentHash": "e18cf8ad9c78a710cba1b6f8935a6d35051bd9ffc8e6eefc70daa9bd22badb3b",
    "entryIndex": 3,
    "sourceId": "normalized.s05.export.smoke.004"
  },
  "manifestRef": {
    "byteLength": 14522,
    "contentHash": "83450daf67bf38c92cb5d92487ff541de36082e0b45433d4853523d5efcd286f",
    "fileSha256": "086c2d4bbda038f2026ce71848d834bdf7368cac46438e3e254127c697c9fd19",
    "id": "FM-NORMALIZE-DELIVER-EXPORT-SMOKE@0.5.0",
    "path": "manifests/export-smoke.v0.5.0.json"
  },
  "mode": "smoke",
  "operation": "export",
  "oracleRef": {
    "id": "ORACLE-INDEPENDENT-PNG@0.5.0",
    "implementationSha256": "c8c3bda622cf22be6b27ebfdb683d597f8d1f4a1b07742b40a80ba6175bf029c",
    "version": "0.5.0"
  },
  "requestId": "request.export.83450daf67bf38c9.14e2f162564e8477.r1.a1",
  "runtimeAttestationRef": {
    "byteLength": 10043,
    "contentHash": "8cc1073efbe5458aec8c49091554337061d64ebfa0fdb2654e0f3b2f89c18e47",
    "fileSha256": "acb3ba370b05c252ec6c4b2f237c10f54d8f31fa4c5cc75d98145ed8e5e80dc3",
    "id": "RUNTIME-SHARP-WIN32-X64@0.5.0",
    "inventoryPayloadSha256": "4fa94c4c225c8ec18abe2751cf4b2344bb643377750503df45a3c65bcfcd0972",
    "path": "runtime/attestation.win32-x64.v0.5.0.json"
  },
  "schemaVersion": "local-run-request.slice05.v0",
  "sourceIdentity": {
    "normalizedArtifactRef": {
      "byteLength": 2623,
      "contentHash": "8ae8a5bc2e271b6383dde25b5826e2547aaccbac1f0bdd19d32c1a6e673deced",
      "fileSha256": "f2ee22acdc1ac20d8e1ac2484bb2d93f3b749c6c1e549a991de63c7fbb255448",
      "id": "normalized.s05.export.smoke.004",
      "path": "artifacts/normalized-inputs/export-smoke/normalized.s05.export.smoke.004.json",
      "producerKind": "independent-fixture-generator"
    },
    "rawAssetRef": {
      "byteLength": 1037,
      "decodedPixelSha256": "a0f96d8e12829ed7766fb13d7798feb24d40f2a1a0bbbd06338c7771b58c3eba",
      "fileSha256": "158a814dc5c497c575f45853708e3cd02c2f4d006e96e7a2e1d7d36c4f20ddf5",
      "mime": "image/png",
      "path": "assets/open/export-smoke/raw.s05.export.smoke.004.png",
      "sourceDeclarationDecodedPixelSha256": "a0f96d8e12829ed7766fb13d7798feb24d40f2a1a0bbbd06338c7771b58c3eba"
    },
    "sourceId": "normalized.s05.export.smoke.004",
    "sourceProvenanceRef": {
      "byteLength": 2359,
      "contentHash": "80b6c06d5b8d724f2f4f398845c7982ae07bb246f51edf9c7df0644fcb43a0fe",
      "fileSha256": "bbcff630a9f1a290cb9eed9af7ca64c303f6f21b77ca2ac9da31175d718d369d",
      "id": "provenance.raw.s05.export.smoke.004",
      "path": "sources/export-smoke/raw.s05.export.smoke.004.json"
    }
  }
}
