{
  "adapterRef": {
    "id": "ADAPTER-SHARP-NORMALIZE-EXPORT@0.5.0",
    "implementationSha256": "ea521c4de76e18a0dae844686498b5d908fb0434eb9b8eeafffdfccbd57b71b1",
    "version": "0.5.0"
  },
  "attempt": {
    "attemptNumber": 1,
    "idempotencyKey": "s05.smoke.normalize.792c7f641d26.00fed4ba5343.r3.a1",
    "partition": "smoke",
    "repetition": 3,
    "runId": "run.smoke.normalize.d914d75e54bb9b5e",
    "sourceId": "raw.s05.normalize.smoke.002"
  },
  "contentHash": "9e7bdee58d10f3996f54c3c66fd86abf6ddee1c343b84421e9062af960342897",
  "contractRef": {
    "byteLength": 5544,
    "contentHash": "48c3a5ec40798289ed66605ffdd80d08acdb8c8910540727a5f4ed08574beb01",
    "fileSha256": "78a7842095cd877bfa7b3388d4f960b5f37612a7827a9d763d19a947247dd068",
    "id": "CC-CAP02-NORMALIZE-PNG@0.5.0",
    "path": "contracts/cc-cap02-normalize-png.v0.5.0.json"
  },
  "createdAt": "2026-08-15T04:52:06.347Z",
  "definitionRef": {
    "byteLength": 108012,
    "contentHash": "d914d75e54bb9b5e175f774038d41235ebeb6dc5daf4b5235d76b3caf4d5c271",
    "fileSha256": "8cbf1f0aaf018c54b95eaa5ef0f3a2f6cb11dc60529ea569408496514d582d96",
    "id": "DEFINITION-INDEX-SLICE05@0.5.0",
    "path": "definition-index.v0.5.0.json"
  },
  "expectedDisposition": "applicable",
  "expectedStableErrorCode": null,
  "goldRecordRef": {
    "byteLength": 1704,
    "contentHash": "aa3c75f6d1fa945c114dd31e672bce05a73037e3d2cbebb066161a9aafc7f2e4",
    "fileSha256": "14f8f318975901385e5a23ccd0ea52195423c733a7f9b568a82e7b4e2c57a7c3",
    "id": "gold.raw.s05.normalize.smoke.002",
    "path": "gold/normalize-smoke/gold.raw.s05.normalize.smoke.002.json"
  },
  "manifestEntryRef": {
    "contentHash": "00fed4ba5343ba1d0161d6f71952077ba40fd9e1a1cea3bf7818fb807127cbbb",
    "entryIndex": 1,
    "sourceId": "raw.s05.normalize.smoke.002"
  },
  "manifestRef": {
    "byteLength": 11858,
    "contentHash": "792c7f641d26a9d5a30bb612e780683da8f58631ba56c46dedd717d7be1fb956",
    "fileSha256": "3aebda4055b08716560b8370d6a5c2806615cb28062c7210ac9ff470e5d63ebf",
    "id": "FM-NORMALIZE-DELIVER-NORMALIZE-SMOKE@0.5.0",
    "path": "manifests/normalize-smoke.v0.5.0.json"
  },
  "mode": "smoke",
  "operation": "normalize",
  "oracleRef": {
    "id": "ORACLE-INDEPENDENT-PNG@0.5.0",
    "implementationSha256": "c8c3bda622cf22be6b27ebfdb683d597f8d1f4a1b07742b40a80ba6175bf029c",
    "version": "0.5.0"
  },
  "requestId": "request.normalize.792c7f641d26a9d5.5adca6ec448ed283.r3.a1",
  "runtimeAttestationRef": {
    "byteLength": 10043,
    "contentHash": "8cc1073efbe5458aec8c49091554337061d64ebfa0fdb2654e0f3b2f89c18e47",
    "fileSha256": "acb3ba370b05c252ec6c4b2f237c10f54d8f31fa4c5cc75d98145ed8e5e80dc3",
    "id": "RUNTIME-SHARP-WIN32-X64@0.5.0",
    "inventoryPayloadSha256": "4fa94c4c225c8ec18abe2751cf4b2344bb643377750503df45a3c65bcfcd0972",
    "path": "runtime/attestation.win32-x64.v0.5.0.json"
  },
  "schemaVersion": "local-run-request.slice05.v0",
  "sourceIdentity": {
    "normalizedArtifactRef": null,
    "rawAssetRef": {
      "byteLength": 1035,
      "decodedPixelSha256": "cbe7e8f4cf08cd859a040c77e7163246a0de03fdae25a11be6d4a0d91967d7c4",
      "fileSha256": "238682f8f88bc29c227dc7fa9a3b66bfd80cccf065ef85b61604305eda260131",
      "mime": "image/png",
      "path": "assets/open/normalize-smoke/raw.s05.normalize.smoke.002.png",
      "sourceDeclarationDecodedPixelSha256": "cbe7e8f4cf08cd859a040c77e7163246a0de03fdae25a11be6d4a0d91967d7c4"
    },
    "sourceId": "raw.s05.normalize.smoke.002",
    "sourceProvenanceRef": {
      "byteLength": 2331,
      "contentHash": "fa5d896c670ffe7d3ee1a83a58f8a5f26af89f5c5db3c0539c99486859d68575",
      "fileSha256": "7cc653ad3062d52d491b20a2204b57513f1ac496d59e64612e3c696096e9e61a",
      "id": "provenance.raw.s05.normalize.smoke.002",
      "path": "sources/normalize-smoke/raw.s05.normalize.smoke.002.json"
    }
  }
}
